{
  "case_coverage": {
    "all_required_cases_evaluated": true,
    "case_kind_coverage_count": 8,
    "case_kind_coverage_ratio": 1.0,
    "case_kinds_expected_count": 8,
    "case_kinds_present_count": 8,
    "cases_total": 8,
    "evaluated_count": 8,
    "evaluated_ratio": 1.0,
    "missing_case_kinds": [],
    "not_evaluated_count": 0,
    "observed_case_kinds": [
      "corrupt_segment",
      "irq_latency_spike",
      "missing_calibration",
      "mutex_hold_inflation",
      "priority_inversion",
      "queue_wait_backlog",
      "stale_sidecar",
      "task_starvation"
    ],
    "reference_only_count": 8,
    "required_case_kinds": [
      "corrupt_segment",
      "irq_latency_spike",
      "missing_calibration",
      "mutex_hold_inflation",
      "priority_inversion",
      "queue_wait_backlog",
      "stale_sidecar",
      "task_starvation"
    ]
  },
  "cases": [
    {
      "affected_entity_retained": true,
      "case_id": "phase6_synthetic_corrupt_segment",
      "case_kind": "corrupt_segment",
      "claim_class": "report_only",
      "closure_metadata_retained": true,
      "deterministic_signal_retained": true,
      "diagnosis_metadata_retained": true,
      "evidence_refs_expected_count": 2,
      "evidence_refs_retained_count": 2,
      "evidence_retention_ratio": 1.0,
      "fail_closed": false,
      "failure_reasons": [],
      "limitations": [
        "No raw proof facts or full traces are embedded.",
        "Reference-only closure never yields replay_pass.",
        "Synthetic metadata replay only."
      ],
      "proof_drift_count": 0,
      "reference_only": true,
      "replay_pass": false,
      "replay_status": "reference_only",
      "root_cause_retained": true,
      "tamper_detected": false
    },
    {
      "affected_entity_retained": true,
      "case_id": "phase6_synthetic_irq_latency_spike",
      "case_kind": "irq_latency_spike",
      "claim_class": "report_only",
      "closure_metadata_retained": true,
      "deterministic_signal_retained": true,
      "diagnosis_metadata_retained": true,
      "evidence_refs_expected_count": 2,
      "evidence_refs_retained_count": 2,
      "evidence_retention_ratio": 1.0,
      "fail_closed": false,
      "failure_reasons": [],
      "limitations": [
        "No raw proof facts or full traces are embedded.",
        "Reference-only closure never yields replay_pass.",
        "Synthetic metadata replay only."
      ],
      "proof_drift_count": 0,
      "reference_only": true,
      "replay_pass": false,
      "replay_status": "reference_only",
      "root_cause_retained": true,
      "tamper_detected": false
    },
    {
      "affected_entity_retained": true,
      "case_id": "phase6_synthetic_missing_calibration",
      "case_kind": "missing_calibration",
      "claim_class": "report_only",
      "closure_metadata_retained": true,
      "deterministic_signal_retained": true,
      "diagnosis_metadata_retained": true,
      "evidence_refs_expected_count": 2,
      "evidence_refs_retained_count": 2,
      "evidence_retention_ratio": 1.0,
      "fail_closed": false,
      "failure_reasons": [],
      "limitations": [
        "No raw proof facts or full traces are embedded.",
        "Reference-only closure never yields replay_pass.",
        "Synthetic metadata replay only."
      ],
      "proof_drift_count": 0,
      "reference_only": true,
      "replay_pass": false,
      "replay_status": "reference_only",
      "root_cause_retained": true,
      "tamper_detected": false
    },
    {
      "affected_entity_retained": true,
      "case_id": "phase6_synthetic_mutex_hold_inflation",
      "case_kind": "mutex_hold_inflation",
      "claim_class": "report_only",
      "closure_metadata_retained": true,
      "deterministic_signal_retained": true,
      "diagnosis_metadata_retained": true,
      "evidence_refs_expected_count": 2,
      "evidence_refs_retained_count": 2,
      "evidence_retention_ratio": 1.0,
      "fail_closed": false,
      "failure_reasons": [],
      "limitations": [
        "No raw proof facts or full traces are embedded.",
        "Reference-only closure never yields replay_pass.",
        "Synthetic metadata replay only."
      ],
      "proof_drift_count": 0,
      "reference_only": true,
      "replay_pass": false,
      "replay_status": "reference_only",
      "root_cause_retained": true,
      "tamper_detected": false
    },
    {
      "affected_entity_retained": true,
      "case_id": "phase6_synthetic_priority_inversion",
      "case_kind": "priority_inversion",
      "claim_class": "report_only",
      "closure_metadata_retained": true,
      "deterministic_signal_retained": true,
      "diagnosis_metadata_retained": true,
      "evidence_refs_expected_count": 2,
      "evidence_refs_retained_count": 2,
      "evidence_retention_ratio": 1.0,
      "fail_closed": false,
      "failure_reasons": [],
      "limitations": [
        "No raw proof facts or full traces are embedded.",
        "Reference-only closure never yields replay_pass.",
        "Synthetic metadata replay only."
      ],
      "proof_drift_count": 0,
      "reference_only": true,
      "replay_pass": false,
      "replay_status": "reference_only",
      "root_cause_retained": true,
      "tamper_detected": false
    },
    {
      "affected_entity_retained": true,
      "case_id": "phase6_synthetic_queue_wait_backlog",
      "case_kind": "queue_wait_backlog",
      "claim_class": "report_only",
      "closure_metadata_retained": true,
      "deterministic_signal_retained": true,
      "diagnosis_metadata_retained": true,
      "evidence_refs_expected_count": 2,
      "evidence_refs_retained_count": 2,
      "evidence_retention_ratio": 1.0,
      "fail_closed": false,
      "failure_reasons": [],
      "limitations": [
        "No raw proof facts or full traces are embedded.",
        "Reference-only closure never yields replay_pass.",
        "Synthetic metadata replay only."
      ],
      "proof_drift_count": 0,
      "reference_only": true,
      "replay_pass": false,
      "replay_status": "reference_only",
      "root_cause_retained": true,
      "tamper_detected": false
    },
    {
      "affected_entity_retained": true,
      "case_id": "phase6_synthetic_stale_sidecar",
      "case_kind": "stale_sidecar",
      "claim_class": "report_only",
      "closure_metadata_retained": true,
      "deterministic_signal_retained": true,
      "diagnosis_metadata_retained": true,
      "evidence_refs_expected_count": 2,
      "evidence_refs_retained_count": 2,
      "evidence_retention_ratio": 1.0,
      "fail_closed": false,
      "failure_reasons": [],
      "limitations": [
        "No raw proof facts or full traces are embedded.",
        "Reference-only closure never yields replay_pass.",
        "Synthetic metadata replay only."
      ],
      "proof_drift_count": 0,
      "reference_only": true,
      "replay_pass": false,
      "replay_status": "reference_only",
      "root_cause_retained": true,
      "tamper_detected": false
    },
    {
      "affected_entity_retained": true,
      "case_id": "phase6_synthetic_task_starvation",
      "case_kind": "task_starvation",
      "claim_class": "report_only",
      "closure_metadata_retained": true,
      "deterministic_signal_retained": true,
      "diagnosis_metadata_retained": true,
      "evidence_refs_expected_count": 2,
      "evidence_refs_retained_count": 2,
      "evidence_retention_ratio": 1.0,
      "fail_closed": false,
      "failure_reasons": [],
      "limitations": [
        "No raw proof facts or full traces are embedded.",
        "Reference-only closure never yields replay_pass.",
        "Synthetic metadata replay only."
      ],
      "proof_drift_count": 0,
      "reference_only": true,
      "replay_pass": false,
      "replay_status": "reference_only",
      "root_cause_retained": true,
      "tamper_detected": false
    }
  ],
  "claim_boundary": {
    "case_claimable_count": 0,
    "case_not_claimable_count": 0,
    "case_report_only_count": 8,
    "claim_class": "report_only",
    "claimable_count": 0,
    "claimable_topics": [],
    "not_claimable_count": 0,
    "not_claimable_topics": [
      "human_helpfulness",
      "llm_explanation",
      "p6_2_plus_approval",
      "top_k_root_cause"
    ],
    "real_hardware_case_count": 0,
    "report_only_count": 8,
    "report_only_topics": [
      "phase6_scope_lock",
      "schema_validity",
      "synthetic_benchmark"
    ],
    "suite_claimable_boundary_count": 0,
    "suite_not_claimable_boundary_count": 4,
    "suite_report_only_boundary_count": 3,
    "synthetic_case_count": 8
  },
  "generated_at": "2026-07-10T00:00:00+08:00",
  "integrity_metrics": {
    "fail_closed_count": 0,
    "forbidden_field_count": 0,
    "inconsistent_status_count": 0,
    "input_mutation_count": 0,
    "invalid_result_count": 0,
    "proof_drift_count": 0,
    "tamper_detected_count": 0
  },
  "limitations": [
    "Metadata-only replay equivalence; no full trace reconstruction or evidence package replay.",
    "No advisor, LLM, hardware, proof correctness, or top-k accuracy claim is established.",
    "Reference-only closure never counts as replay_pass even with retention ratio 1.0.",
    "Synthetic-only frozen P6.2 fixtures; not real RTOS traces or generalization evidence.",
    "Zero proof drift here means no supplied deterministic facts diverged; it does not prove proof artifact parity."
  ],
  "notes": [
    "Cases are sorted by case_id and canonical JSON uses sorted keys.",
    "If generated_at is omitted, the report copies suite.generated_at and never reads current time.",
    "Raw full_diagnosis, replay_diagnosis, source_records, and proof facts are intentionally omitted."
  ],
  "preservation_metrics": {
    "affected_entity_retained_count": 8,
    "closure_metadata_retained_count": 8,
    "deterministic_signal_retained_count": 8,
    "diagnosis_metadata_retained_count": 8,
    "evidence_refs_expected_count": 16,